{
  "$schema": "http://json-schema.org/draft-07/schema#",
  "$id": "style_profile.schema.json",
  "title": "Style Profile (clean-room, non-runtime style-intake contract)",
  "description": "Clean-room, idea-only BRAND / STYLE intake shape for szh-ppt-master. A style_profile captures the abstract design direction a deck should follow — palette, background mode, a typography scale, recurring page motifs, the layout archetypes the style supports, and an image-usage policy that biases the deck toward editable shapes / tables / KPI structures over generated images. It is the next quality layer ABOVE the existing runtime design_system tokens, NOT a runtime application contract: no script projects a style_profile onto a design_system today, so every profile pins runtime_status to the literal non_runtime_contract. The schema deliberately refuses real-brand wording, URL- and path-shaped values, and trademark punctuation at the field-shape level (same gates as schemas/brand_preset.schema.json). It carries no proprietary assets, no copied template slides, and no public URLs. The image_usage_policy block STRUCTURALLY encodes that generated images are auxiliary: its mode enum has no image-first option and editable_structures_first is locked true. This schema uses only the JSON Schema keyword subset that scripts/validate_artifacts.py implements. See references/strategy-and-style-layer.md for the policy envelope.",
  "type": "object",
  "additionalProperties": false,
  "required": [
    "schema_version",
    "profile_id",
    "display_name",
    "runtime_status",
    "palette",
    "background_mode",
    "typography_scale",
    "page_motifs",
    "layout_archetypes",
    "image_usage_policy"
  ],
  "properties": {
    "schema_version": {
      "type": "string",
      "enum": ["1"],
      "description": "Profile schema version. Locked to '1'; bumped only with a paired contract change."
    },
    "profile_id": {
      "type": "string",
      "minLength": 1,
      "maxLength": 64,
      "pattern": "^synthetic_[a-z0-9][a-z0-9_]*$",
      "description": "Stable identifier. Forced to start with the literal prefix 'synthetic_' so a profile can never be authored under a real brand id; the rest is lowercase ASCII letters, digits, and underscore. The prefix is a fail-closed gate against real-brand authorship at the schema layer."
    },
    "display_name": {
      "type": "string",
      "minLength": 1,
      "maxLength": 80,
      "pattern": "^[A-Za-z0-9][A-Za-z0-9 _\\-]*$",
      "description": "Human-readable label. The pattern excludes punctuation that real brand marks frequently use (trademark glyphs, parentheses, ampersand, dot, comma, slash, colon) and excludes URL-like shapes."
    },
    "runtime_status": {
      "type": "string",
      "enum": ["non_runtime_contract"],
      "description": "Hard literal. There is no 'runtime' / 'applied' state today — no script projects a style_profile onto a design_system. The literal locks the document at the shape-only contract layer."
    },
    "palette": {
      "type": "object",
      "required": ["primary", "background", "text"],
      "additionalProperties": false,
      "description": "Closed set of palette tokens. The token NAMES are fixed and the VALUES are constrained to 6-digit hex colours so neither URLs nor named-brand colour wording can slip in. Mirrors schemas/design_system.schema.json so a future projection helper would be straightforward.",
      "properties": {
        "primary":    { "type": "string", "pattern": "^#[0-9A-Fa-f]{6}$" },
        "secondary":  { "type": "string", "pattern": "^#[0-9A-Fa-f]{6}$" },
        "accent":     { "type": "string", "pattern": "^#[0-9A-Fa-f]{6}$" },
        "background": { "type": "string", "pattern": "^#[0-9A-Fa-f]{6}$" },
        "text":       { "type": "string", "pattern": "^#[0-9A-Fa-f]{6}$" }
      }
    },
    "background_mode": {
      "type": "string",
      "enum": ["solid", "subtle_tint", "gradient_band", "paneled"],
      "description": "Closed enum describing how slide backgrounds are filled. Abstract design modes only — no proprietary background asset is referenced. 'solid' = flat fill; 'subtle_tint' = near-background tint; 'gradient_band' = a single banded gradient region; 'paneled' = a divided panel block."
    },
    "typography_scale": {
      "type": "object",
      "required": ["heading", "body", "scale_ratio"],
      "additionalProperties": false,
      "description": "A modular type scale. heading/body each carry a CSS-style font fallback chain plus a positive point size; scale_ratio is the step multiplier between scale levels. The font_family pattern excludes URL- and path-shaped values.",
      "properties": {
        "heading": {
          "type": "object",
          "required": ["font_family", "size_pt"],
          "additionalProperties": false,
          "properties": {
            "font_family": {
              "type": "string",
              "minLength": 1,
              "maxLength": 200,
              "pattern": "^[A-Za-z][A-Za-z0-9 \\-]*(\\s*,\\s*[A-Za-z][A-Za-z0-9 \\-]*)*$",
              "description": "CSS-style fallback chain, preferred -> fallback. Only ASCII letters, digits, hyphen, and a single space inside each entry; excludes ':' '/' '?' '#' '\\\\' and quotes."
            },
            "size_pt": { "type": "number", "exclusiveMinimum": 0 }
          }
        },
        "body": {
          "type": "object",
          "required": ["font_family", "size_pt"],
          "additionalProperties": false,
          "properties": {
            "font_family": {
              "type": "string",
              "minLength": 1,
              "maxLength": 200,
              "pattern": "^[A-Za-z][A-Za-z0-9 \\-]*(\\s*,\\s*[A-Za-z][A-Za-z0-9 \\-]*)*$"
            },
            "size_pt": { "type": "number", "exclusiveMinimum": 0 }
          }
        },
        "scale_ratio": {
          "type": "number",
          "minimum": 1,
          "maximum": 2,
          "description": "Modular-scale step multiplier between levels (e.g. 1.25). 1 = no scaling; capped at 2."
        }
      }
    },
    "page_motifs": {
      "type": "array",
      "minItems": 1,
      "maxItems": 8,
      "uniqueItems": true,
      "items": {
        "type": "string",
        "enum": [
          "corner_accent",
          "left_rail",
          "header_band",
          "footer_band",
          "section_number",
          "card_grid",
          "divider_line",
          "watermark_number"
        ]
      },
      "description": "Closed enum set of recurring, abstract decoration motifs the style reuses across pages. No proprietary graphic asset is referenced — each motif is drawable from the controlled render primitives (shapes / lines / text)."
    },
    "layout_archetypes": {
      "type": "array",
      "minItems": 1,
      "maxItems": 12,
      "uniqueItems": true,
      "items": {
        "type": "string",
        "enum": [
          "cover_hero",
          "executive_summary_cards",
          "kpi_cluster",
          "comparison_panel",
          "metric_table",
          "audience_segment",
          "competitor_flow",
          "product_strategy",
          "roadmap",
          "closing_summary"
        ]
      },
      "description": "The visual-structure archetypes this style supports. Shares the exact vocabulary used by strategy_plan.slides[].visual_structure so a future validator can cross-check that every planned slide's structure is one the chosen style declares."
    },
    "image_usage_policy": {
      "type": "object",
      "required": ["mode", "max_image_slides_ratio", "editable_structures_first"],
      "additionalProperties": false,
      "description": "Policy that biases the deck toward editable structures over generated images. STRUCTURALLY encodes that images are auxiliary: 'mode' has no image-first option and editable_structures_first is locked true.",
      "properties": {
        "mode": {
          "type": "string",
          "enum": ["auxiliary", "minimal", "none"],
          "description": "How much the style leans on generated images. 'auxiliary' = occasional spot illustration; 'minimal' = rare; 'none' = editable structures only. There is intentionally NO image-first / image-primary option."
        },
        "max_image_slides_ratio": {
          "type": "number",
          "minimum": 0,
          "maximum": 1,
          "description": "Soft upper bound on the fraction of slides that may carry a generated image. A small value (e.g. 0.25) keeps most slides on editable shapes / tables / KPI structures."
        },
        "editable_structures_first": {
          "type": "boolean",
          "enum": [true],
          "description": "Locked true. Asserts that editable shapes, tables, and KPI structures are the primary visual vehicle and generated images are auxiliary."
        }
      }
    },
    "notes": {
      "type": "string",
      "maxLength": 280,
      "description": "Optional short author note. Keep it terse and synthetic; no real-brand wording, URLs, or path-shaped values."
    }
  }
}
